{
	"__comment__": "Gegenereerd op basis van commit#164 in het DUO_RIO_Linked_Data op 20190904 om 11:54. Gemaakt met template-jsonschema.json",
    "$schema": "http://json-schema.org/draft-04/schema#",
    "title": "VavoOnderwijslicentie JSON-Schema",
	"type": "object",
	"additionalProperties": false,
	"properties": {
		"_links": {
			"properties": {
				"self": {
					"description": "Absolute link naar deze resource",
					"properties": {
						"href": {
							"description": "URL van de link",
							"format": "uri",
							"type": "string"
						}
					},
					"required": [
						"href"
					],
					"type": "object"
				}
				,
				"vavoOpleidingserkenning": {
					"description": "Deze resource heeft een associatie geeftToestemmingVoor met VavoOpleidingserkenning",
					"externalDocs": { 
						"url": "http://lod.onderwijsregistratie.nl/cat/rio/def/geeftToestemmingVoor",
						"description": "geeftToestemmingVoor"
					},
					"properties": {
						"href": {
							"description": "URL van de link",
							"format": "uri",
							"type": "string"
						}
					},
					"required": [
						"href"
					],
					"type": "object"
				}
				,
				"onderwijsinstellingserkenning": {
					"description": "Deze resource heeft een associatie geeftToestemmingAan met Onderwijsinstellingserkenning",
					"externalDocs": { 
						"url": "http://lod.onderwijsregistratie.nl/cat/rio/def/geeftToestemmingAan",
						"description": "geeftToestemmingAan"
					},
					"properties": {
						"href": {
							"description": "URL van de link",
							"format": "uri",
							"type": "string"
						}
					},
					"required": [
						"href"
					],
					"type": "object"
				}
			},
			"required": [
				"self"
				,"vavoOpleidingserkenning"
				,"onderwijsinstellingserkenning"
			],
			"type": "object"
		},
		"uri": {
			"type": "string",
			"format": "uri",
			"description": "URI van de specifieke resource"
		},
		"bekostigd": {
			"type": "boolean",
			"externalDocs": { 
				"url": "http://lod.onderwijsregistratie.nl/cat/cdm/def/bekostigingsIndicatie",
				"description": "bekostigingsIndicatie"
			},
			"description": "De bekostigingsindicatie geeft aan of een inschrijving, graad, licentie of instelling in aanmerking komt voor bekostiging in de vorm van een rijksbijdrage."
		},
		"stadium": {
			"type": "string",
			"externalDocs": { 
				"url": "http://lod.onderwijsregistratie.nl/cat/cdm/def/licentiestadium-v01",
				"description": "licentiestadium-v01"
			},
			"description": "De toestand waarin een licentie zich bevindt.",
			"maxLength": 70,
			"minLength": 1,
			"pattern": "^[A-Z0-9_]*$"
		},
		"begindatum": {
			"type": "string",
			"externalDocs": { 
				"url": "http://lod.onderwijsregistratie.nl/cat/cdm/def/periodeBegindatum-v01",
				"description": "periodeBegindatum-v01"
			},
			"description": "De datum die het begin van de periode aangeeft (inclusief).",
			"format": "date"
		},
		"einddatum": {
			"type": "string",
			"externalDocs": { 
				"url": "http://lod.onderwijsregistratie.nl/cat/cdm/def/periodeEinddatum-v01",
				"description": "periodeEinddatum-v01"
			},
			"description": "De datum die het einde van de periode aangeeft (exclusief).",
			"format": "date"
		}
	},
	"required": [
		"_links",
		"bekostigd",
		"stadium",
		"begindatum"
	]
}
